{
  "version": 1,
  "payload_id": "pay_duplicate_01",
  "payload_id": "pay_duplicate_02",
  "issued_at": "2026-08-24T11:59:00Z",
  "expires_at": "2026-08-24T12:01:00Z",
  "recipient_device_id": "dev_fixture_01",
  "recipient_workspace_id": "wsp_fixture_01",
  "recipient_registration_id": "agr_fixture_01",
  "ciphertext": "ZW5jcnlwdGVk"
}
